{"artifact_bytes":{"boundaries":1543,"clusters":3937,"convergence":35097,"correlations":2894,"countries":5000,"coverage":7397,"facts":1768,"indicators":2010,"longrun":4866,"narratives":24483,"panel_income":123250,"panel_structure":143670,"rankings":25292,"reconciliation":1563,"validation":1196},"artifact_tags":{"boundaries":"DERIVED","clusters":"DERIVED","convergence":"DERIVED","correlations":"DERIVED","countries":"OBSERVED","coverage":"DERIVED","facts":"DERIVED","indicators":"DERIVED","longrun":"DERIVED","narratives":"DERIVED","panel_income":"OBSERVED","panel_structure":"OBSERVED","rankings":"DERIVED","reconciliation":"OBSERVED","validation":"DERIVED"},"assumptions":["Aggregates are identified by region == 'Aggregates' in the World Bank country list and excluded from all analysis.","No interpolation: a missing country-year stays null. Rankings and statistics use only countries with data.","Convergence is absolute (unconditional); correlations are descriptive; clusters are unsupervised labels. None is causal.","Income groups are the current World Bank classification at retrieval.","hhi5 is a 5-group export concentration index (DERIVED) that understates product-level concentration."],"counts":{"aggregates":79,"countries":217,"indicators":17,"wb_entities":296},"disclaimers":["Educational use only. Not investment, policy or economic advice.","A dated snapshot of WDI, not a live feed; WDI revises history.","Latest-year values can be provisional estimates.","Not sponsored, endorsed or approved by the World Bank, Our World in Data or the Maddison Project."],"excluded_sources":[{"name":"IMF World Economic Outlook","reason":"Automated bulk download requires written permission (copyright@imf.org); no IMF endpoint is called."}],"latest_year_rule":{"min_share_of_peak":0.9,"peak_window":[2010,2022],"text":"Latest year per indicator = the latest year (from 2010) with a country count of at least 90 percent of that indicator's peak yearly count over 2010 to 2022. Missing values are never interpolated; rankings and statistics use only countries with data and publish n."},"pipeline_version":"1.0.0","retrieved_at":"2026-10-11T02:37:57Z","schema_version":"v1","sources":[{"attribution":"Source: World Bank, World Development Indicators (CC BY 4.0).","dataset":"World Development Indicators","id":"wdi","licence":"CC BY 4.0","licence_url":"https://datacatalog.worldbank.org/search/dataset/0037712","publisher":"The World Bank","role":"all indicators except the long-run series","url":"https://api.worldbank.org/v2/"},{"attribution":"Source: Bolt and van Zanden, Maddison Project Database 2023 (CC BY 4.0), via Our World in Data.","dataset":"GDP per capita, Maddison Project Database 2023","id":"owid_maddison","licence":"CC BY 4.0 (origin record of the Maddison series, per OWID metadata)","licence_url":"https://www.rug.nl/ggdc/historicaldevelopment/maddison/releases/maddison-project-database-2023","publisher":"Our World in Data / Maddison Project (Bolt and van Zanden)","role":"long-run context only","url":"https://ourworldindata.org/grapher/gdp-per-capita-maddison"}],"tags":{"counts":"DERIVED","vintage":"OBSERVED"},"vintage":{"owid_maddison_last_updated":"2024-04-26","text":"World Bank WDI as last updated 2026-10-08, retrieved 2026-10-11T02:37:57Z. WDI revises history with each release.","wdi_lastupdated":"2026-10-08","wdi_source_id":"2"},"years":{"fetch_first":1960,"first":1990,"last":2025}}
